{
  "$schema": "path/to/qds/schemas/product-release.schema.json",
  "schemaVersion": 1,
  "product": {
    "name": "ExamplePlayer",
    "artifactStem": "ExamplePlayer",
    "bundleIdentifier": "com.example.player",
    "humanReleaseName": "ExamplePlayer 1.0.0 Beta 1 (1)"
  },
  "release": {
    "marketingVersion": "1.0.0",
    "build": 1,
    "channel": "beta",
    "iteration": 1,
    "version": "1.0.0-beta.1",
    "tag": "v1.0.0-beta.1"
  },
  "platform": {
    "name": "macOS",
    "minimumVersion": "26.0",
    "architecture": "arm64"
  },
  "distribution": {
    "signing": "ad-hoc",
    "notarized": false,
    "gatekeeperDisclosure": true
  },
  "installer": {
    "format": "dmg",
    "style": "product-defined-monochrome",
    "applicationsAlias": true
  },
  "artifacts": {
    "installer": "ExamplePlayer-1.0.0-beta.1-arm64.dmg",
    "update": "ExamplePlayer-1.0.0-beta.1-arm64.zip",
    "checksums": "ExamplePlayer-1.0.0-beta.1-SHA256SUMS.txt"
  }
}
